{
  "edges": [
    {
      "contractId": "contract.auth.login",
      "from": "work.auth-contract",
      "kind": "contract-dependency",
      "to": "work.login-ui"
    },
    {
      "from": "work.login-ui",
      "kind": "coordination",
      "to": "work.audit-log"
    }
  ],
  "nodes": [
    {
      "id": "work.auth-contract",
      "kind": "implementation",
      "requiredForDone": false,
      "responsibilityUnitId": "ru.auth-service"
    },
    {
      "id": "work.login-ui",
      "kind": "implementation",
      "requiredForDone": true,
      "responsibilityUnitId": "ru.frontend"
    },
    {
      "id": "work.audit-log",
      "kind": "implementation",
      "requiredForDone": false,
      "responsibilityUnitId": "ru.audit"
    }
  ],
  "runId": "board",
  "schemaVersion": "1.0"
}
